id,address
10,札幌市東区北6条東4丁目1-7
11,岩手県盛岡市天神町13-29
12,札幌市中央区中島公園1番5号 札幌市中島体育センター2F
13,札幌市東区北8条東11丁目1番39号
14,札幌市厚別区厚別中央2条4丁目9-15 新札幌中央メディカルビル3F
15,札幌市西区二十四軒2条6丁目1-8
16,
17,札幌市白石区本通4丁目南2-6 タザワビルディング2F
19,札幌市西区発寒14条11丁目1-15
20,札幌市中央区南1条西3-3
21,札幌市南区石山1条6丁目1番地18
22,札幌市中央区北5条西12丁目2番地
23,日高郡新ひだか町三石港町26番地
24,釧路市文苑1丁目1番13号
25,東京都品川区東品川二丁目2番20号 天王洲オーシャンスクエア25F
26,東京都渋谷区渋谷3-13-11 渋谷TKビル2階
27,札幌市西区発寒3条1丁目6-6
28,札幌市中央区北4条西5 アスティ45 1F
30,札幌市中央区南9条西9丁目1-32 S9条ビル
38,札幌市豊平区福住2条1-2-5
39,東京都中央区月島3-17-9 西仲通り商店街四番街
41,
42,札幌市白石区南郷通18丁目北7-17
45,札幌市白石区菊水7条4丁目2番24号
46,
47,
48,札幌市中央区北5条西5丁目7番地 sapporo55 5F
49,
50,札幌市白石区本通19丁目南2番7号 食糧ビル2F
53,
157,札幌市中央区北5条西6丁目1番地23
159,札幌市北区新琴似6条13丁目5番14号
161,
162,札幌市東区伏古1条5丁目3-5-1F
168,札幌市東区北5条東8丁目1-33
176,
